A1: EQY_FUND_CRNCY | B1: REL_INDEX | C1: FA_ADJUSTED
A2: BRL | C2: ADJUSTED
A3: Ticker | B3: Name | C3: Mkt Cap (BRL) | D3: Last Px | E3: Chg Pct 1D | F3: Chg Pct 1M | G3: Rev - 1 Yr Gr:Y | H3: EPS - 1 Yr Gr:Y | I3: P/E | J3: ROE | K3: Dvd 12M Yld
A4: None (20 securities)
A5: Median | B5: Median | C5: =IFERROR(MEDIAN($C6:$C25),0) ->  | D5: =IFERROR(MEDIAN($D6:$D25),0) ->  | E5: =IFERROR(MEDIAN($E6:$E25),0) ->  | F5: =IFERROR(MEDIAN($F6:$F25),0) ->  | G5: =IFERROR(MEDIAN($G6:$G25),0) ->  | H5: =IFERROR(MEDIAN($H6:$H25),0) ->  | I5: =IFERROR(MEDIAN($I6:$I25),0) ->  | J5: =IFERROR(MEDIAN($J6:$J25),0) ->  | K5: =IFERROR(MEDIAN($K6:$K25),0) -> 
A6: PETR4 BZ Equity | B6: PETROBRAS - PETROLEO BRAS-PR | C6: =BDP($A6,"CRNCY_ADJ_MKT_CAP",$A$1:$C$1,$A$2:$C$2) -> 360652865147.66003 | D6: =BDP($A6,"CRNCY_ADJ_PX_LAST",$A$1:$C$1,$A$2:$C$2) -> 26.289999999999999 | E6: =BDP($A6,"CHG_PCT_1D",$A$1:$C$1,$A$2:$C$2) -> 3.0172409999999998 | F6: =BDP($A6,"CHG_PCT_1M",$A$1:$C$1,$A$2:$C$2) -> -4.746378 | G6: =BDP($A6,"SALES_GROWTH","FUND_PER","Y",$A$1:$C$1,$A$2:$C$2) -> 23.314122561201291 | H6: =BDP($A6,"DILUTED_EPS_AFT_XO_ITEMS_GROWTH","FUND_PER","Y",$A$1:$C$1,$A$2:$C$2) -> 556.03640584072673 | I6: =BDP($A6,"PE_RATIO",$A$1:$C$1,$A$2:$C$2) -> 15.027142531788817 | J6: =BDP($A6,"RETURN_COM_EQY",$A$1:$C$1,$A$2:$C$2) -> 12.014402552831028 | K6: =BDP($A6,"DIVIDEND_12_MONTH_YIELD",$A$1:$C$1,$A$2:$C$2) -> 3.5605057875617643
A7: IMO CN Equity | B7: IMPERIAL OIL LTD | C7: =BDP($A7,"CRNCY_ADJ_MKT_CAP",$A$1:$C$1,$A$2:$C$2) -> 88484893225.963699 | D7: =BDP($A7,"CRNCY_ADJ_PX_LAST",$A$1:$C$1,$A$2:$C$2) -> 114.54810000000001 | E7: =BDP($A7,"CHG_PCT_1D",$A$1:$C$1,$A$2:$C$2) -> 0.77107150000000002 | F7: =BDP($A7,"CHG_PCT_1M",$A$1:$C$1,$A$2:$C$2) -> -3.7582559999999998 | G7: =BDP($A7,"SALES_GROWTH","FUND_PER","Y",$A$1:$C$1,$A$2:$C$2) -> 21.291709165088154 | H7: =BDP($A7,"DILUTED_EPS_AFT_XO_ITEMS_GROWTH","FUND_PER","Y",$A$1:$C$1,$A$2:$C$2) -> 708.8041726043931 | I7: =BDP($A7,"PE_RATIO",$A$1:$C$1,$A$2:$C$2) -> 14.476523406084764 | J7: =BDP($A7,"RETURN_COM_EQY",$A$1:$C$1,$A$2:$C$2) -> 8.4935893503466051 | K7: =BDP($A7,"DIVIDEND_12_MONTH_YIELD",$A$1:$C$1,$A$2:$C$2) -> 2.0052770196919707
A8: EQNR NO Equity | B8: EQUINOR ASA | C8: =BDP($A8,"CRNCY_ADJ_MKT_CAP",$A$1:$C$1,$A$2:$C$2) -> 282934302941.07343 | D8: =BDP($A8,"CRNCY_ADJ_PX_LAST",$A$1:$C$1,$A$2:$C$2) -> 84.712090000000003 | E8: =BDP($A8,"CHG_PCT_1D",$A$1:$C$1,$A$2:$C$2) -> -0.35354910000000001 | F8: =BDP($A8,"CHG_PCT_1M",$A$1:$C$1,$A$2:$C$2) -> -7.6612869999999997 | G8: =BDP($A8,"SALES_GROWTH","FUND_PER","Y",$A$1:$C$1,$A$2:$C$2) -> 28.839940299486642 | H8: =BDP($A8,"DILUTED_EPS_AFT_XO_ITEMS_GROWTH","FUND_PER","Y",$A$1:$C$1,$A$2:$C$2) -> 9.1615634695073656 | I8: =BDP($A8,"PE_RATIO",$A$1:$C$1,$A$2:$C$2) -> 8.7471649362209725 | J8: =BDP($A8,"RETURN_COM_EQY",$A$1:$C$1,$A$2:$C$2) -> 11.805286926375331 | K8: =BDP($A8,"DIVIDEND_12_MONTH_YIELD",$A$1:$C$1,$A$2:$C$2) -> 4.440714698691556
A9: CVE CN Equity | B9: CENOVUS ENERGY INC | C9: =BDP($A9,"CRNCY_ADJ_MKT_CAP",$A$1:$C$1,$A$2:$C$2) -> 43572262147.651245 | D9: =BDP($A9,"CRNCY_ADJ_PX_LAST",$A$1:$C$1,$A$2:$C$2) -> 35.467590000000001 | E9: =BDP($A9,"CHG_PCT_1D",$A$1:$C$1,$A$2:$C$2) -> 0.90283749999999996 | F9: =BDP($A9,"CHG_PCT_1M",$A$1:$C$1,$A$2:$C$2) -> -13.074070000000001 | G9: =BDP($A9,"SALES_GROWTH","FUND_PER","Y",$A$1:$C$1,$A$2:$C$2) -> 23.512680730030812 | H9: =BDP($A9,"DILUTED_EPS_AFT_XO_ITEMS_GROWTH","FUND_PER","Y",$A$1:$C$1,$A$2:$C$2) ->  | I9: =BDP($A9,"PE_RATIO",$A$1:$C$1,$A$2:$C$2) ->  | J9: =BDP($A9,"RETURN_COM_EQY",$A$1:$C$1,$A$2:$C$2) -> -1.2094293478260874 | K9: =BDP($A9,"DIVIDEND_12_MONTH_YIELD",$A$1:$C$1,$A$2:$C$2) -> 1.7043033913952472
A10: MOL HB Equity | B10: MOL HUNGARIAN OIL AND GAS PL | C10: =BDP($A10,"CRNCY_ADJ_MKT_CAP",$A$1:$C$1,$A$2:$C$2) -> 35778420154.10183 | D10: =BDP($A10,"CRNCY_ADJ_PX_LAST",$A$1:$C$1,$A$2:$C$2) -> 43.66413 | E10: =BDP($A10,"CHG_PCT_1D",$A$1:$C$1,$A$2:$C$2) -> 0.44642860000000001 | F10: =BDP($A10,"CHG_PCT_1M",$A$1:$C$1,$A$2:$C$2) -> -4.8338369999999999 | G10: =BDP($A10,"SALES_GROWTH","FUND_PER","Y",$A$1:$C$1,$A$2:$C$2) -> 25.139650196594935 | H10: =BDP($A10,"DILUTED_EPS_AFT_XO_ITEMS_GROWTH","FUND_PER","Y",$A$1:$C$1,$A$2:$C$2) -> 8.350453185494084 | I10: =BDP($A10,"PE_RATIO",$A$1:$C$1,$A$2:$C$2) -> 7.5948508078477648 | J10: =BDP($A10,"RETURN_COM_EQY",$A$1:$C$1,$A$2:$C$2) -> 18.024958360669103 | K10: =BDP($A10,"DIVIDEND_12_MONTH_YIELD",$A$1:$C$1,$A$2:$C$2) -> 2.6915769474350855
A11: XOM US Equity | B11: EXXON MOBIL CORP | C11: =BDP($A11,"CRNCY_ADJ_MKT_CAP",$A$1:$C$1,$A$2:$C$2) -> 1308334842917.2639 | D11: =BDP($A11,"CRNCY_ADJ_PX_LAST",$A$1:$C$1,$A$2:$C$2) -> 309.01310000000001 | E11: =BDP($A11,"CHG_PCT_1D",$A$1:$C$1,$A$2:$C$2) -> 0.47430830000000002 | F11: =BDP($A11,"CHG_PCT_1M",$A$1:$C$1,$A$2:$C$2) -> -6.0027090000000003 | G11: =BDP($A11,"SALES_GROWTH","FUND_PER","Y",$A$1:$C$1,$A$2:$C$2) -> 17.781094779096144 | H11: =BDP($A11,"DILUTED_EPS_AFT_XO_ITEMS_GROWTH","FUND_PER","Y",$A$1:$C$1,$A$2:$C$2) -> 37.177753255081626 | I11: =BDP($A11,"PE_RATIO",$A$1:$C$1,$A$2:$C$2) -> 17.210807135427668 | J11: =BDP($A11,"RETURN_COM_EQY",$A$1:$C$1,$A$2:$C$2) -> 9.9884823294686313 | K11: =BDP($A11,"DIVIDEND_12_MONTH_YIELD",$A$1:$C$1,$A$2:$C$2) -> 4.3660678165806415
A12: HSE CN Equity | B12: HUSKY ENERGY INC | C12: =BDP($A12,"CRNCY_ADJ_MKT_CAP",$A$1:$C$1,$A$2:$C$2) -> 40731378239.069 | D12: =BDP($A12,"CRNCY_ADJ_PX_LAST",$A$1:$C$1,$A$2:$C$2) -> 40.530070000000002 | E12: =BDP($A12,"CHG_PCT_1D",$A$1:$C$1,$A$2:$C$2) -> -0.59303189999999995 | F12: =BDP($A12,"CHG_PCT_1M",$A$1:$C$1,$A$2:$C$2) -> -7.4534149999999997 | G12: =BDP($A12,"SALES_GROWTH","FUND_PER","Y",$A$1:$C$1,$A$2:$C$2) -> 19.743851907657536 | H12: =BDP($A12,"DILUTED_EPS_AFT_XO_ITEMS_GROWTH","FUND_PER","Y",$A$1:$C$1,$A$2:$C$2) -> 28.036143392817564 | I12: =BDP($A12,"PE_RATIO",$A$1:$C$1,$A$2:$C$2) -> 11.114122268119798 | J12: =BDP($A12,"RETURN_COM_EQY",$A$1:$C$1,$A$2:$C$2) -> 6.7637514511581625 | K12: =BDP($A12,"DIVIDEND_12_MONTH_YIELD",$A$1:$C$1,$A$2:$C$2) -> 3.3557046090907607
A13: ECOPETL CB Equity | B13: ECOPETROL SA | C13: =BDP($A13,"CRNCY_ADJ_MKT_CAP",$A$1:$C$1,$A$2:$C$2) -> 154001958187.46613 | D13: =BDP($A13,"CRNCY_ADJ_PX_LAST",$A$1:$C$1,$A$2:$C$2) -> 3.7399339999999999 | E13: =BDP($A13,"CHG_PCT_1D",$A$1:$C$1,$A$2:$C$2) -> 1.3136289999999999 | F13: =BDP($A13,"CHG_PCT_1M",$A$1:$C$1,$A$2:$C$2) -> 1.8151820000000001 | G13: =BDP($A13,"SALES_GROWTH","FUND_PER","Y",$A$1:$C$1,$A$2:$C$2) -> 22.8394490846478 | H13: =BDP($A13,"DILUTED_EPS_AFT_XO_ITEMS_GROWTH","FUND_PER","Y",$A$1:$C$1,$A$2:$C$2) -> 115.22655594619326 | I13: =BDP($A13,"PE_RATIO",$A$1:$C$1,$A$2:$C$2) -> 10.524424247981447 | J13: =BDP($A13,"RETURN_COM_EQY",$A$1:$C$1,$A$2:$C$2) -> 25.263680863802463 | K13: =BDP($A13,"DIVIDEND_12_MONTH_YIELD",$A$1:$C$1,$A$2:$C$2) -> 7.2933549432739051
A14: 857 HK Equity | B14: PETROCHINA CO LTD-H | C14: =BDP($A14,"CRNCY_ADJ_MKT_CAP",$A$1:$C$1,$A$2:$C$2) -> 737849865085.13342 | D14: =BDP($A14,"CRNCY_ADJ_PX_LAST",$A$1:$C$1,$A$2:$C$2) -> 2.3746299999999998 | E14: =BDP($A14,"CHG_PCT_1D",$A$1:$C$1,$A$2:$C$2) -> -0.21691969999999999 | F14: =BDP($A14,"CHG_PCT_1M",$A$1:$C$1,$A$2:$C$2) -> -8.7301579999999994 | G14: =BDP($A14,"SALES_GROWTH","FUND_PER","Y",$A$1:$C$1,$A$2:$C$2) -> 29.332589659824322 | H14: =BDP($A14,"DILUTED_EPS_AFT_XO_ITEMS_GROWTH","FUND_PER","Y",$A$1:$C$1,$A$2:$C$2) -> 95.627321036541574 | I14: =BDP($A14,"PE_RATIO",$A$1:$C$1,$A$2:$C$2) -> 14.047925188260903 | J14: =BDP($A14,"RETURN_COM_EQY",$A$1:$C$1,$A$2:$C$2) -> 7.2020861612967293 | K14: =BDP($A14,"DIVIDEND_12_MONTH_YIELD",$A$1:$C$1,$A$2:$C$2) -> 3.8248229285945068
A15: YPFD AR Equity | B15: YPF S.A.-D | C15: =BDP($A15,"CRNCY_ADJ_MKT_CAP",$A$1:$C$1,$A$2:$C$2) -> 24434229331.222378 | D15: =BDP($A15,"CRNCY_ADJ_PX_LAST",$A$1:$C$1,$A$2:$C$2) -> 62.153489999999998 | E15: =BDP($A15,"CHG_PCT_1D",$A$1:$C$1,$A$2:$C$2) -> -1.7307969999999999 | F15: =BDP($A15,"CHG_PCT_1M",$A$1:$C$1,$A$2:$C$2) -> 8.7197300000000002 | G15: =BDP($A15,"SALES_GROWTH","FUND_PER","Y",$A$1:$C$1,$A$2:$C$2) -> 72.388286994735239 | H15: =BDP($A15,"DILUTED_EPS_AFT_XO_ITEMS_GROWTH","FUND_PER","Y",$A$1:$C$1,$A$2:$C$2) -> 355.78212682844736 | I15: =BDP($A15,"PE_RATIO",$A$1:$C$1,$A$2:$C$2) -> 11.071013558059546 | J15: =BDP($A15,"RETURN_COM_EQY",$A$1:$C$1,$A$2:$C$2) -> 7.0907541733853883 | K15: =BDP($A15,"DIVIDEND_12_MONTH_YIELD",$A$1:$C$1,$A$2:$C$2) -> 0.44410482070678536
A16: CVX US Equity | B16: CHEVRON CORP | C16: =BDP($A16,"CRNCY_ADJ_MKT_CAP",$A$1:$C$1,$A$2:$C$2) -> 940006543068.61023 | D16: =BDP($A16,"CRNCY_ADJ_PX_LAST",$A$1:$C$1,$A$2:$C$2) -> 493.18110000000001 | E16: =BDP($A16,"CHG_PCT_1D",$A$1:$C$1,$A$2:$C$2) -> 0.7199603 | F16: =BDP($A16,"CHG_PCT_1M",$A$1:$C$1,$A$2:$C$2) -> 1.5434669999999999 | G16: =BDP($A16,"SALES_GROWTH","FUND_PER","Y",$A$1:$C$1,$A$2:$C$2) -> 24.646915902500197 | H16: =BDP($A16,"DILUTED_EPS_AFT_XO_ITEMS_GROWTH","FUND_PER","Y",$A$1:$C$1,$A$2:$C$2) -> 137.60290550006263 | I16: =BDP($A16,"PE_RATIO",$A$1:$C$1,$A$2:$C$2) -> 15.099329057378402 | J16: =BDP($A16,"RETURN_COM_EQY",$A$1:$C$1,$A$2:$C$2) -> 10.100988536383312 | K16: =BDP($A16,"DIVIDEND_12_MONTH_YIELD",$A$1:$C$1,$A$2:$C$2) -> 3.795908212602976
A17: GALP PL Equity | B17: GALP ENERGIA SGPS SA | C17: =BDP($A17,"CRNCY_ADJ_MKT_CAP",$A$1:$C$1,$A$2:$C$2) -> 54035846614.700829 | D17: =BDP($A17,"CRNCY_ADJ_PX_LAST",$A$1:$C$1,$A$2:$C$2) -> 65.124700000000004 | E17: =BDP($A17,"CHG_PCT_1D",$A$1:$C$1,$A$2:$C$2) -> 0.9463722 | F17: =BDP($A17,"CHG_PCT_1M",$A$1:$C$1,$A$2:$C$2) -> -0.069395189999999995 | G17: =BDP($A17,"SALES_GROWTH","FUND_PER","Y",$A$1:$C$1,$A$2:$C$2) -> 13.024602026049203 | H17: =BDP($A17,"DILUTED_EPS_AFT_XO_ITEMS_GROWTH","FUND_PER","Y",$A$1:$C$1,$A$2:$C$2) -> 14.975682347897639 | I17: =BDP($A17,"PE_RATIO",$A$1:$C$1,$A$2:$C$2) -> 19.543734697228555 | J17: =BDP($A17,"RETURN_COM_EQY",$A$1:$C$1,$A$2:$C$2) -> 13.20067860718656 | K17: =BDP($A17,"DIVIDEND_12_MONTH_YIELD",$A$1:$C$1,$A$2:$C$2) -> 4.3923610614405737
A18: SU CN Equity | B18: SUNCOR ENERGY INC | C18: =BDP($A18,"CRNCY_ADJ_MKT_CAP",$A$1:$C$1,$A$2:$C$2) -> 208409649370.80774 | D18: =BDP($A18,"CRNCY_ADJ_PX_LAST",$A$1:$C$1,$A$2:$C$2) -> 132.6823 | E18: =BDP($A18,"CHG_PCT_1D",$A$1:$C$1,$A$2:$C$2) -> 1.3154859999999999 | F18: =BDP($A18,"CHG_PCT_1M",$A$1:$C$1,$A$2:$C$2) -> -1.3039559999999999 | G18: =BDP($A18,"SALES_GROWTH","FUND_PER","Y",$A$1:$C$1,$A$2:$C$2) -> 20.617137134631033 | H18: =BDP($A18,"DILUTED_EPS_AFT_XO_ITEMS_GROWTH","FUND_PER","Y",$A$1:$C$1,$A$2:$C$2) -> -15.102791574866202 | I18: =BDP($A18,"PE_RATIO",$A$1:$C$1,$A$2:$C$2) -> 17.835951314712265 | J18: =BDP($A18,"RETURN_COM_EQY",$A$1:$C$1,$A$2:$C$2) -> 8.8918602707671734 | K18: =BDP($A18,"DIVIDEND_12_MONTH_YIELD",$A$1:$C$1,$A$2:$C$2) -> 3.4176349965823651
A19: RDSA LN Equity | B19: ROYAL DUTCH SHELL PLC-A SHS | C19: =BDP($A19,"CRNCY_ADJ_MKT_CAP",$A$1:$C$1,$A$2:$C$2) -> 1064258248861.8666 | D19: =BDP($A19,"CRNCY_ADJ_PX_LAST",$A$1:$C$1,$A$2:$C$2) -> 130.65090000000001 | E19: =BDP($A19,"CHG_PCT_1D",$A$1:$C$1,$A$2:$C$2) -> -0.019692790000000002 | F19: =BDP($A19,"CHG_PCT_1M",$A$1:$C$1,$A$2:$C$2) -> 2.9191159999999998 | G19: =BDP($A19,"SALES_GROWTH","FUND_PER","Y",$A$1:$C$1,$A$2:$C$2) -> 27.262688454972327 | H19: =BDP($A19,"DILUTED_EPS_AFT_XO_ITEMS_GROWTH","FUND_PER","Y",$A$1:$C$1,$A$2:$C$2) -> 27.523851103852117 | I19: =BDP($A19,"PE_RATIO",$A$1:$C$1,$A$2:$C$2) -> 11.353083714788735 | J19: =BDP($A19,"RETURN_COM_EQY",$A$1:$C$1,$A$2:$C$2) -> 10.839413091633304 | K19: =BDP($A19,"DIVIDEND_12_MONTH_YIELD",$A$1:$C$1,$A$2:$C$2) -> 5.7764822370263564
A20: REP SM Equity | B20: REPSOL SA | C20: =BDP($A20,"CRNCY_ADJ_MKT_CAP",$A$1:$C$1,$A$2:$C$2) -> 106235737903.71579 | D20: =BDP($A20,"CRNCY_ADJ_PX_LAST",$A$1:$C$1,$A$2:$C$2) -> 68.109589999999997 | E20: =BDP($A20,"CHG_PCT_1D",$A$1:$C$1,$A$2:$C$2) -> 1.2096769999999999 | F20: =BDP($A20,"CHG_PCT_1M",$A$1:$C$1,$A$2:$C$2) -> -0.033186729999999998 | G20: =BDP($A20,"SALES_GROWTH","FUND_PER","Y",$A$1:$C$1,$A$2:$C$2) -> 19.691369876163964 | H20: =BDP($A20,"DILUTED_EPS_AFT_XO_ITEMS_GROWTH","FUND_PER","Y",$A$1:$C$1,$A$2:$C$2) -> 9.0299143949205458 | I20: =BDP($A20,"PE_RATIO",$A$1:$C$1,$A$2:$C$2) -> 11.809254989423188 | J20: =BDP($A20,"RETURN_COM_EQY",$A$1:$C$1,$A$2:$C$2) -> 9.0171731837981266 | K20: =BDP($A20,"DIVIDEND_12_MONTH_YIELD",$A$1:$C$1,$A$2:$C$2) -> 5.9495353762055458
A21: 386 HK Equity | B21: CHINA PETROLEUM & CHEMICAL-H | C21: =BDP($A21,"CRNCY_ADJ_MKT_CAP",$A$1:$C$1,$A$2:$C$2) -> 383133739369.3941 | D21: =BDP($A21,"CRNCY_ADJ_PX_LAST",$A$1:$C$1,$A$2:$C$2) -> 2.9579629999999999 | E21: =BDP($A21,"CHG_PCT_1D",$A$1:$C$1,$A$2:$C$2) -> -0.52083330000000005 | F21: =BDP($A21,"CHG_PCT_1M",$A$1:$C$1,$A$2:$C$2) -> -6.2193149999999999 | G21: =BDP($A21,"SALES_GROWTH","FUND_PER","Y",$A$1:$C$1,$A$2:$C$2) -> 32.976218656775067 | H21: =BDP($A21,"DILUTED_EPS_AFT_XO_ITEMS_GROWTH","FUND_PER","Y",$A$1:$C$1,$A$2:$C$2) -> 3.355854059758121 | I21: =BDP($A21,"PE_RATIO",$A$1:$C$1,$A$2:$C$2) -> 10.669106688421213 | J21: =BDP($A21,"RETURN_COM_EQY",$A$1:$C$1,$A$2:$C$2) -> 8.5366945079672387 | K21: =BDP($A21,"DIVIDEND_12_MONTH_YIELD",$A$1:$C$1,$A$2:$C$2) -> 11.789161081297443
A22: OMV AV Equity | B22: OMV AG | C22: =BDP($A22,"CRNCY_ADJ_MKT_CAP",$A$1:$C$1,$A$2:$C$2) -> 65339976568.502121 | D22: =BDP($A22,"CRNCY_ADJ_PX_LAST",$A$1:$C$1,$A$2:$C$2) -> 199.53489999999999 | E22: =BDP($A22,"CHG_PCT_1D",$A$1:$C$1,$A$2:$C$2) -> 1.77624 | F22: =BDP($A22,"CHG_PCT_1M",$A$1:$C$1,$A$2:$C$2) -> -10.814640000000001 | G22: =BDP($A22,"SALES_GROWTH","FUND_PER","Y",$A$1:$C$1,$A$2:$C$2) -> 13.391355948966472 | H22: =BDP($A22,"DILUTED_EPS_AFT_XO_ITEMS_GROWTH","FUND_PER","Y",$A$1:$C$1,$A$2:$C$2) -> 3.340977830682899 | I22: =BDP($A22,"PE_RATIO",$A$1:$C$1,$A$2:$C$2) -> 10.40566012544452 | J22: =BDP($A22,"RETURN_COM_EQY",$A$1:$C$1,$A$2:$C$2) -> 16.537894576322877 | K22: =BDP($A22,"DIVIDEND_12_MONTH_YIELD",$A$1:$C$1,$A$2:$C$2) -> 3.9790814006366535
A23: BP/ LN Equity | B23: BP PLC | C23: =BDP($A23,"CRNCY_ADJ_MKT_CAP",$A$1:$C$1,$A$2:$C$2) -> 588295288423.79333 | D23: =BDP($A23,"CRNCY_ADJ_PX_LAST",$A$1:$C$1,$A$2:$C$2) -> 28.827089999999998 | E23: =BDP($A23,"CHG_PCT_1D",$A$1:$C$1,$A$2:$C$2) -> 0.52045940000000002 | F23: =BDP($A23,"CHG_PCT_1M",$A$1:$C$1,$A$2:$C$2) -> -1.3387370000000001 | G23: =BDP($A23,"SALES_GROWTH","FUND_PER","Y",$A$1:$C$1,$A$2:$C$2) -> 24.37387597415573 | H23: =BDP($A23,"DILUTED_EPS_AFT_XO_ITEMS_GROWTH","FUND_PER","Y",$A$1:$C$1,$A$2:$C$2) -> 19.486031253169397 | I23: =BDP($A23,"PE_RATIO",$A$1:$C$1,$A$2:$C$2) -> 14.477228001434241 | J23: =BDP($A23,"RETURN_COM_EQY",$A$1:$C$1,$A$2:$C$2) -> 13.3772145228863 | K23: =BDP($A23,"DIVIDEND_12_MONTH_YIELD",$A$1:$C$1,$A$2:$C$2) -> 5.6355647839854557
A24: FP FP Equity | B24: TOTAL SA | C24: =BDP($A24,"CRNCY_ADJ_MKT_CAP",$A$1:$C$1,$A$2:$C$2) -> 598286013886.77612 | D24: =BDP($A24,"CRNCY_ADJ_PX_LAST",$A$1:$C$1,$A$2:$C$2) -> 225.06460000000001 | E24: =BDP($A24,"CHG_PCT_1D",$A$1:$C$1,$A$2:$C$2) -> 1.0970040000000001 | F24: =BDP($A24,"CHG_PCT_1M",$A$1:$C$1,$A$2:$C$2) -> -1.063617 | G24: =BDP($A24,"SALES_GROWTH","FUND_PER","Y",$A$1:$C$1,$A$2:$C$2) -> 23.479030711138236 | H24: =BDP($A24,"DILUTED_EPS_AFT_XO_ITEMS_GROWTH","FUND_PER","Y",$A$1:$C$1,$A$2:$C$2) -> 13.84142574293209 | I24: =BDP($A24,"PE_RATIO",$A$1:$C$1,$A$2:$C$2) -> 14.453965516925622 | J24: =BDP($A24,"RETURN_COM_EQY",$A$1:$C$1,$A$2:$C$2) -> 11.516013044568945 | K24: =BDP($A24,"DIVIDEND_12_MONTH_YIELD",$A$1:$C$1,$A$2:$C$2) -> 5.1039886704572028
A25: ENI IM Equity | B25: ENI SPA | C25: =BDP($A25,"CRNCY_ADJ_MKT_CAP",$A$1:$C$1,$A$2:$C$2) -> 239114070627.06339 | D25: =BDP($A25,"CRNCY_ADJ_PX_LAST",$A$1:$C$1,$A$2:$C$2) -> 65.757859999999994 | E25: =BDP($A25,"CHG_PCT_1D",$A$1:$C$1,$A$2:$C$2) -> 0.86015540000000001 | F25: =BDP($A25,"CHG_PCT_1M",$A$1:$C$1,$A$2:$C$2) -> -5.7801980000000004 | G25: =BDP($A25,"SALES_GROWTH","FUND_PER","Y",$A$1:$C$1,$A$2:$C$2) -> 13.304143815657735 | H25: =BDP($A25,"DILUTED_EPS_AFT_XO_ITEMS_GROWTH","FUND_PER","Y",$A$1:$C$1,$A$2:$C$2) -> 68.722360154637386 | I25: =BDP($A25,"PE_RATIO",$A$1:$C$1,$A$2:$C$2) -> 12.300955449097419 | J25: =BDP($A25,"RETURN_COM_EQY",$A$1:$C$1,$A$2:$C$2) -> 9.4062012433082209 | K25: =BDP($A25,"DIVIDEND_12_MONTH_YIELD",$A$1:$C$1,$A$2:$C$2) -> 5.7083905317104504